{
  "$schema": "https://json-schema.org/draft/2020-12/schema",
  "$id": "https://eventcal.org/schema/v1",
  "title": "eventcal/v1 (nucleo)",
  "description": "Nucleo agnostico: valida el esqueleto comun de cualquier calendario y evento. No conoce ningun tipo concreto; 'details' es un objeto generico cuya forma valida cada extension por separado (validacion en dos fases via registro).",
  "$ref": "#/$defs/calendar",

  "$defs": {
    "calendar": {
      "type": "object",
      "required": ["schema", "id", "name", "events"],
      "additionalProperties": false,
      "properties": {
        "schema": { "const": "eventcal/v1" },
        "id": { "$ref": "#/$defs/slug" },
        "name": { "type": "string", "minLength": 1 },
        "description": { "type": "string" },
        "category": { "type": "string" },
        "tags": { "type": "array", "items": { "type": "string" } },
        "image": { "$ref": "#/$defs/image" },
        "timezone": { "type": "string" },
        "updated": { "type": "string", "format": "date-time" },
        "source": { "$ref": "#/$defs/source" },
        "groups": { "type": "array", "items": { "$ref": "#/$defs/group" } },
        "events": { "type": "array", "items": { "$ref": "#/$defs/event" } }
      }
    },

    "slug": {
      "type": "string",
      "pattern": "^[a-z0-9][a-z0-9._-]*$",
      "description": "Identificador estable en minusculas."
    },

    "image": {
      "type": "object",
      "required": ["url"],
      "additionalProperties": false,
      "properties": {
        "url": { "type": "string", "format": "uri" },
        "alt": { "type": "string" },
        "credit": { "type": "string" }
      }
    },

    "source": {
      "type": "object",
      "additionalProperties": false,
      "properties": {
        "publisher": { "type": "string" },
        "url": { "type": "string", "format": "uri" },
        "license": { "type": "string" }
      }
    },

    "group": {
      "type": "object",
      "required": ["id", "label"],
      "additionalProperties": false,
      "properties": {
        "id": { "type": "string" },
        "label": { "type": "string" },
        "date": { "type": "string", "format": "date" },
        "order": { "type": "integer" }
      }
    },

    "location": {
      "type": "object",
      "additionalProperties": false,
      "properties": {
        "name": { "type": "string" },
        "address": { "type": "string" },
        "city": { "type": "string" },
        "country": { "type": "string", "pattern": "^[A-Z]{2}$" },
        "lat": { "type": "number", "minimum": -90, "maximum": 90 },
        "lon": { "type": "number", "minimum": -180, "maximum": 180 }
      }
    },

    "datetime": {
      "type": "string",
      "pattern": "^\\d{4}-\\d{2}-\\d{2}([T ]\\d{2}:\\d{2}(:\\d{2})?(\\.\\d+)?(Z|[+-]\\d{2}:\\d{2})?)?$",
      "description": "Con offset = instante absoluto; sin offset = hora local flotante."
    },

    "event": {
      "type": "object",
      "required": ["title", "start"],
      "additionalProperties": false,
      "properties": {
        "id": { "$ref": "#/$defs/slug" },
        "title": { "type": "string", "minLength": 1 },
        "start": { "$ref": "#/$defs/datetime" },
        "end": { "$ref": "#/$defs/datetime" },
        "allDay": { "type": "boolean" },
        "status": { "enum": ["confirmed", "tentative", "cancelled", "postponed"], "default": "confirmed" },
        "image": { "$ref": "#/$defs/image" },
        "location": { "$ref": "#/$defs/location" },
        "url": { "type": "string", "format": "uri" },
        "group": { "type": "string" },
        "order": { "type": "integer" },
        "partOf": { "type": "string" },
        "type": {
          "type": "string",
          "pattern": "^[a-z][a-z0-9_]*\\.[a-z][a-z0-9_]*$",
          "description": "Discriminador 'categoria.subtipo'. El registro lo usa para elegir la extension."
        },
        "details": {
          "type": "object",
          "description": "Generico aqui. Su forma la valida la extension del 'type' correspondiente."
        }
      }
    }
  }
}
