{
  "schema": "eventcal/v1",
  "id": "f1-2023",
  "name": "Formula 1 - Temporada 2023",
  "category": "motorsport",
  "timezone": "UTC",
  "source": {
    "publisher": "OpenF1",
    "url": "https://openf1.org",
    "license": "CC-BY-4.0"
  },
  "events": [
    {
      "id": "f1-1216",
      "title": "Belgian Grand Prix 2023",
      "start": "2023-07-28T11:30:00+00:00",
      "type": "motorsport.event",
      "location": {
        "name": "Spa-Francorchamps",
        "country": "BE"
      },
      "details": {
        "discipline": "f1"
      }
    },
    {
      "id": "f1-9140",
      "title": "Sprint Qualifying",
      "start": "2023-07-29T15:05:00+00:00",
      "end": "2023-07-29T15:35:00+00:00",
      "status": "confirmed",
      "partOf": "f1-1216",
      "location": {
        "name": "Spa-Francorchamps",
        "country": "BE"
      },
      "type": "motorsport.session",
      "details": {
        "discipline": "f1",
        "session": "sprint_qualifying"
      }
    },
    {
      "id": "f1-9141",
      "title": "Race",
      "start": "2023-07-30T13:00:00+00:00",
      "end": "2023-07-30T15:00:00+00:00",
      "status": "confirmed",
      "partOf": "f1-1216",
      "location": {
        "name": "Spa-Francorchamps",
        "country": "BE"
      },
      "type": "motorsport.session",
      "details": {
        "discipline": "f1",
        "session": "race"
      }
    }
  ]
}